{
  "artifact": "thread_status",
  "schema_version": "0.1",
  "thread": "thr-diffusivity-crosscheck",
  "round": 1,
  "turn": "simulation_agent",
  "state": "open",
  "updated_at": "2026-09-17T11:05:00Z",
  "blocked_pairs": [],
  "substitutions": [],
  "open_question": null,
  "note": "Held until 2026-09-17, when contracts/observables.json got its first entry and capabilities/simulation.json declared bd_overdamped. The gate resolved to yes without anything in this thread being re-argued, so the turn passed from a person to the engine side. The envelope from the held period stays on disk: the attempt is on the record (P1)."
}
